{
  "schema_version": 1,
  "created_at": "2026-10-26T09:00:00Z",
  "machine": "mba",
  "workspace": "ai-skills-10",
  "agent": "packet",
  "repo": "ai-skills",
  "branch": "concurrency/10-packet",
  "head_sha": "14954fc",
  "unit": "10/1.2",
  "blocks": "",
  "continues_on": "door.py tests",
  "id": "gen0info0001",
  "door": "info",
  "type": "generic",
  "title": "FYI: outbox path is .decision-queue/outbox",
  "options": [],
  "payload": {
    "body": "The schema uses a small keyword subset.\n\n- no pip deps\n- same file as the queue's"
  },
  "reply": "[lane mba/ai-skills-10/packet gen0info0001] ack"
}
