{
  "schema_version": 1,
  "created_at": "2026-10-26T09:00:00Z",
  "machine": "mba",
  "workspace": "ai-skills-10",
  "agent": "packet",
  "repo": "ai-skills",
  "branch": "concurrency/10-packet",
  "head_sha": "14954fc",
  "unit": "10/1.2",
  "blocks": "queue service migration 0002",
  "continues_on": "",
  "id": "dm0one-way01",
  "door": "one-way",
  "type": "data-model",
  "title": "Add tenant_id to packets table",
  "options": [
    {
      "id": "a",
      "label": "NOT NULL with backfill",
      "detail": "Backfill from machine",
      "recommended": true
    },
    {
      "id": "b",
      "label": "Nullable, backfill later",
      "recommended": false
    }
  ],
  "payload": {
    "tables": [
      {
        "name": "packets",
        "change": "changed",
        "columns": [
          {
            "name": "id",
            "before": "text primary key",
            "after": "text primary key",
            "changed": false
          },
          {
            "name": "tenant_id",
            "before": null,
            "after": "text not null",
            "changed": true
          }
        ]
      },
      {
        "name": "views",
        "change": "unchanged",
        "columns": [
          {
            "name": "viewer",
            "before": "text",
            "after": "text",
            "changed": false
          }
        ]
      }
    ]
  },
  "reply": "[lane mba/ai-skills-10/packet dm0one-way01] Option a: NOT NULL with backfill."
}
